{
  "schema": "dm.conformance.registry/v1",
  "suite_version": "DM-026.23",
  "fixture_seed": "dm026-v1",
  "scenarios": [
    {
      "id": "adapter_storage_non_authority",
      "owners": ["DM-021", "DM-022"],
      "specifications": ["specs/adapter-contracts.md", "specs/identity-root-v1.md"],
      "setup": "Root-bound manifest with exact body and transport principal evidence.",
      "stimulus": "Substitute body key, transport principal, and provisional storage evidence.",
      "fault": "Nominal identifiers are retained while authority evidence is changed.",
      "expected": "Every substitution fails and storage or route metadata grants no authority.",
      "evidence": ["tests.test_dm021_identity.PluralAuthorizationTests.test_body_key_and_principal_substitution_fail_closed", "tests.test_dm022_ledger.AuthorizationAndCompatibilityTests.test_root_authority_binds_body_incarnation_principal_and_signer"],
      "cleanup": "Synthetic in-memory artifacts only.",
      "platform": "all",
      "ci_lane": "fast",
      "required": true
    },
    {
      "id": "authority_epoch_succession",
      "owners": ["DM-079"],
      "specifications": ["docs/dm079-authority-epochs.md", "schemas/weave/v1/authority-epoch.schema.json"],
      "setup": "A non-empty root-authorized ledger, exact prior manifest and signed next-incarnation successor epoch.",
      "stimulus": "Reopen the same SQLite ledger and hosted bundle under the exact successor, then attempt downgrade and corrupt-event migration.",
      "fault": "Manifest history is removed, rewritten, forked or advanced before every immutable old event verifies against its exact epoch.",
      "expected": "The epoch set grows atomically, old bytes remain exact, the new incarnation starts its own chain, replay is idempotent and every downgrade or corruption fails closed.",
      "evidence": ["tests.test_dm079_authority_epochs.AuthorityEpochTests.test_corrupt_stored_event_rolls_back_epoch_metadata", "tests.test_dm079_authority_epochs.AuthorityEpochTests.test_nonempty_ledger_advances_without_rewriting_old_events", "tests.test_dm079_authority_epochs.AuthorityEpochTests.test_public_vectors_verify_and_regenerate_byte_identically", "tests.test_dm079_authority_epochs.AuthorityEpochTests.test_sequence_body_active_and_history_forks_fail_closed", "tests.test_dm079_authority_epochs.AuthorityEpochTests.test_sqlite_fault_before_commit_retains_old_epoch_then_retry_succeeds", "tests.test_dm079_authority_epochs.HostedAuthorityEpochTests.test_v7_bundle_reopens_existing_runtime_under_exact_successor"],
      "cleanup": "Close SQLite and hosted runtime handles before removing the isolated roots.",
      "platform": "all",
      "ci_lane": "complete",
      "required": true
    },
    {
      "id": "birth_contract_integrity",
      "owners": ["DM-021", "DM-060"],
      "specifications": ["specs/birth-first-awakening.md", "specs/identity-root-v1.md"],
      "setup": "Distinct parent, newborn and witness roots with purpose-bound credentials and a closed offer, acceptance and activation receipt.",
      "stimulus": "Validate the positive lineage, then mutate copied context, signature domains, origins, time, first-embodiment evidence, key roles and the empty-ledger cutoff.",
      "fault": "A parent precommits or retains control of the newborn, transport context substitutes for authority, or nonempty history is presented as a fresh awakening.",
      "expected": "Only the independently self-certifying newborn root accepts; every substitution fails closed; one root-authorized sequence-zero embodiment activates over a mechanically empty ledger.",
      "evidence": ["tests.test_dm060_synthetic_birth.BirthContractTests.test_activation_cannot_substitute_another_newborn_or_acceptance", "tests.test_dm060_synthetic_birth.BirthContractTests.test_closed_public_schema_accepts_every_runtime_artifact", "tests.test_dm060_synthetic_birth.BirthContractTests.test_distinct_root_birth_first_embodiment_and_empty_memory_activate", "tests.test_dm060_synthetic_birth.BirthContractTests.test_expiry_wrong_purpose_and_wrong_origin_are_rejected", "tests.test_dm060_synthetic_birth.BirthContractTests.test_nonempty_newborn_ledger_cannot_activate", "tests.test_dm060_synthetic_birth.BirthContractTests.test_offer_acceptance_and_activation_tamper_fail_closed", "tests.test_dm060_synthetic_birth.BirthContractTests.test_parent_offer_cannot_precommit_newborn_or_reuse_key_roles"],
      "cleanup": "Close the isolated newborn ledger and remove only fixture-owned owner-only temporary roots.",
      "platform": "all",
      "ci_lane": "complete",
      "required": true
    },
    {
      "id": "birth_durable_one_use",
      "owners": ["DM-060"],
      "specifications": ["schemas/birth/v1/contracts.schema.json", "specs/birth-first-awakening.md"],
      "setup": "Owner-only DELETE/FULL SQLite birth registry with one cryptographically verified offer and acceptance.",
      "stimulus": "Crash before accept and activation commits, retry exact bytes concurrently, present a second valid acceptance, and attempt unsafe store paths.",
      "fault": "Response loss, concurrent replay, partial commit or arrival ordering could duplicate an effect, select one sibling lineage or follow a symlink.",
      "expected": "Exact replay has one durable effect, crashes roll back, both sibling acceptances remain quarantined without a winner, and unsafe custody paths fail closed.",
      "evidence": ["tests.test_dm060_synthetic_birth.BirthRegistryTests.test_accept_and_activation_crashes_roll_back_then_retry_exactly_once", "tests.test_dm060_synthetic_birth.BirthRegistryTests.test_concurrent_exact_acceptance_has_one_durable_effect", "tests.test_dm060_synthetic_birth.BirthRegistryTests.test_double_acceptance_is_retained_and_quarantined_without_winner", "tests.test_dm060_synthetic_birth.BirthRegistryTests.test_store_requires_owner_only_parent_and_regular_file"],
      "cleanup": "Close every registry connection before removing the exact temporary directory.",
      "platform": "all",
      "ci_lane": "complete",
      "required": true
    },
    {
      "id": "birth_legacy_runtime_rejected",
      "owners": ["DM-024", "DM-025", "DM-060"],
      "specifications": ["docs/dm024-hosted-runtime.md", "docs/dm060-synthetic-birth.md", "schemas/hosted/v7/bundle.schema.json"],
      "setup": "Clearly named historical V3 birth fixture plus production V7 runtime and V3 client loaders.",
      "stimulus": "Present every pre-V7 runtime version and pre-V3 client version, including the archived fixture shape.",
      "fault": "Never-deployed compatibility could reopen authority, custody, or retired-server response fallback paths.",
      "expected": "Production rejects obsolete versions before authority or custody is opened; only V7 and client config V3 remain operational.",
      "evidence": ["tests.test_dm024_runtime.RuntimeBundleTests.test_runtime_rejects_every_pre_v7_bundle_before_authority_or_custody", "tests.test_dm025_client.LocalClientTests.test_pre_v3_config_is_rejected_without_response_fallback", "tests.test_dm060_synthetic_birth.SyntheticBirthJourneyTests.test_scenario_loader_rejects_unknown_fields_and_symlinks"],
      "cleanup": "Remove only temporary fixture documents; no daemon or custody is opened.",
      "platform": "all",
      "ci_lane": "complete",
      "required": true
    },
    {
      "id": "canonical_artifacts",
      "owners": ["DM-011", "DM-021"],
      "specifications": ["specs/canonical-artifacts.md"],
      "setup": "Canonical JSON and signed identity fixtures.",
      "stimulus": "Reorder UTF-16 keys and present non-NFC, float, or unsafe integer values.",
      "fault": "Semantically tempting but non-canonical inputs.",
      "expected": "Canonical bytes are deterministic and invalid values fail before signing.",
      "evidence": ["tests.test_dm021_identity.CanonicalizationTests.test_non_nfc_float_and_unsafe_integer_are_rejected", "tests.test_dm021_identity.CanonicalizationTests.test_object_keys_use_jcs_utf16_order"],
      "cleanup": "No persistent state.",
      "platform": "all",
      "ci_lane": "fast",
      "required": true
    },
    {
      "id": "causal_quarantine_promotion",
      "owners": ["DM-022"],
      "specifications": ["specs/weave-protocol.md"],
      "setup": "Root-authorized ledgers with an event whose causal proof is missing.",
      "stimulus": "Ingest the child before and then after its required parent.",
      "fault": "Out-of-order explicit causal evidence.",
      "expected": "Child remains incomplete without projection effect and promotes without byte rewrite only after validation.",
      "evidence": ["tests.test_dm022_ledger.LedgerBehaviorTests.test_causal_missing_is_incomplete_then_promotes_without_rewrite"],
      "cleanup": "Temporary ledgers are removed by the fixture.",
      "platform": "all",
      "ci_lane": "fast",
      "required": true
    },
    {
      "id": "cli_closed_retry_surface",
      "owners": ["DM-025"],
      "specifications": ["docs/dm025-cli-mcp.md"],
      "setup": "Real daemon socket, descriptor key, owner-only config, payload and retry file.",
      "stimulus": "Run installed-style CLI status and repeat one observe request token.",
      "fault": "Shell-like model text and repeated process invocation.",
      "expected": "Exactly one event, canonical redacted output, and no generic method surface.",
      "evidence": ["tests.test_dm025_cli_mcp.InstalledSurfaceTests.test_cli_real_daemon_json_and_exact_retry", "tests.test_dm025_cli_mcp.InstalledSurfaceTests.test_every_cli_command_maps_to_exactly_one_closed_method"],
      "cleanup": "Fixture stops daemon and removes its isolated state root.",
      "platform": "linux",
      "ci_lane": "complete",
      "required": true
    },
    {
      "id": "cluster_effect_truth",
      "owners": ["DM-037"],
      "specifications": ["docs/dm037-cluster-effect-boundary.md", "specs/adapter-contracts.md"],